{
  "resourceType": "DeviceDispense",
  "id": "example",
  "text": {
    "status": "generated",
    "div": "<div xmlns=\"http://www.w3.org/1999/xhtml\">[Put rendering here]</div>"
  },
  "status": "completed",
  "device": {
    "concept": {
      "coding": [
        {
          "system": "https://www.gs1.org/gtin",
          "code": "00613994223838",
          "display": "ADAPTA (TM) Pacemaker"
        }
      ]
    }
  },
  "subject": {
    "reference": "Patient/pat1",
    "display": "Donald Duck"
  },
  "meta": {
    "tag": [
      {
        "system": "http://terminology.hl7.org/CodeSystem/v3-ActReason",
        "code": "HTEST",
        "display": "test health data"
      }
    ]
  }
}
